{                                                                                
    "model_family": "mimo_audio",                                                  
    "model_path": "SURE_train/model/MiMo-Audio-7B-Base-merged",                                                              
    "whisper_path": "",                                                            
    "dataset_path": "../combined_asr.jsonl",                                       
    "dataset_name": "combined_asr",                                                
    "source_code_url": "SURE_train/MiMo-Audio",                                    
    "paper_url": "SURE_train/papers/Mimo Audio.pdf",                               
    "max_gpus": 7,                                                                 
    "output_run_id": ""                                                            
}        